{"run":38,"commit":"ceeda9b","metric":132.1,"metrics":{"profile_visible_rows_ready_p95_ms":134.12,"profile_post_paint_ready_median_ms":133.2,"profile_post_paint_ready_p95_ms":135.28,"presorted_full_first_render_p50_ms":74.201584,"presorted_full_first_render_p95_ms":267.879083,"prepare_presorted_input_p50_ms":0.355834,"prepare_presorted_input_p95_ms":0.43975,"build_p50_ms":73.844375,"build_p95_ms":267.437208,"visible_first_p50_ms":0.001375,"visible_first_p95_ms":0.002125,"rename_leaf_p50_ms":0.013,"rename_leaf_p95_ms":0.016875,"rename_root_directory_p50_ms":0.723417,"rename_root_directory_p95_ms":0.761042},"status":"discard","description":"Validation rerun with mutation guardrails on unchanged lazy-maps code; profile stable at 132.1ms and mutation latencies remain sub-millisecond.","timestamp":1775498599034,"segment":2,"confidence":8.149999999999999,"iterationTokens":14410,"asi":{"hypothesis":"The lazy ensureChildIdByNameId and ensureChildPositions helpers should correctly rebuild Maps on first mutation, keeping mutation latencies unchanged.","rollback_reason":"No code changes; this was a validation-only rerun with mutation guardrails.","validation":"Profile stable at 132.1ms. Mutation guardrails healthy: rename-leaf p50=0.013ms (unchanged), rename-root-directory p50=0.723ms (slightly better than 0.735ms baseline).","next_action_hint":"Try eliminating directories.get() from the backward pass by moving totalChildSubtreeNodeCount computation into initializeOpenVisibleCounts, or try making initializeOpenVisibleCounts non-recursive."}}
{"run":39,"commit":"acee459","metric":130.8,"metrics":{"profile_visible_rows_ready_p95_ms":136.28,"profile_post_paint_ready_median_ms":131.8,"profile_post_paint_ready_p95_ms":137.28,"presorted_full_first_render_p50_ms":73.619751,"presorted_full_first_render_p95_ms":269.442709,"prepare_presorted_input_p50_ms":0.354584,"prepare_presorted_input_p95_ms":0.437583,"build_p50_ms":73.26375,"build_p95_ms":269.003042,"visible_first_p50_ms":0.001417,"visible_first_p95_ms":0.002084,"rename_leaf_p50_ms":0.013,"rename_leaf_p95_ms":0.016875,"rename_root_directory_p50_ms":0.723417,"rename_root_directory_p95_ms":0.761042},"status":"keep","description":"Eliminate directories.get() from backward pass by computing totalChildSubtreeNodeCount during initializeOpenVisibleCounts instead of during buildPresortedFinish.","timestamp":1775498684577,"segment":2,"confidence":5.267904509283817,"iterationTokens":6150,"asi":{"hypothesis":"The backward pass does directories.get(node.parentId) for ~700K nodes just to accumulate directory aggregates. Moving this computation into initializeOpenVisibleCounts (which already iterates all directory children) eliminates ~700K Map.get calls.","validation":"Profile median improved from 132.3ms to 130.8ms (-1.1%). Bun p50 improved from 76.2ms to 73.6ms (-3.4%). Smaller than estimated because the Map.get was probably well-cached after the forward pass.","mechanism":"Removed directories.get + aggregate accumulation from buildPresortedFinish backward pass. Added totalChildSubtreeNodeCount computation to initializeOpenVisibleCounts alongside the existing totalChildVisibleSubtreeCount loop.","total_from_baseline":"Profile: 230.1ms → 130.8ms (-43.2%). Bun: 149.1ms → 73.6ms (-50.6%).","next_action_hint":"The dominant remaining cost is appendPresortedPaths (~55-60ms in Bun). Try making initializeOpenVisibleCounts non-recursive, or look at reducing node allocation overhead in the ingest loop."}}
{"run":40,"commit":"acee459","metric":131.6,"metrics":{"profile_visible_rows_ready_p95_ms":132.72,"profile_post_paint_ready_median_ms":132.7,"profile_post_paint_ready_p95_ms":133.8,"presorted_full_first_render_p50_ms":264.993459,"presorted_full_first_render_p95_ms":268.43575,"prepare_presorted_input_p50_ms":0.354459,"prepare_presorted_input_p95_ms":0.43475,"build_p50_ms":264.637583,"build_p95_ms":267.998917,"visible_first_p50_ms":0.001417,"visible_first_p95_ms":0.002083,"rename_leaf_p50_ms":0.013,"rename_leaf_p95_ms":0.016875,"rename_root_directory_p50_ms":0.723417,"rename_root_directory_p95_ms":0.761042},"status":"checks_failed","description":"Non-recursive initializeOpenVisibleCounts improved Chrome profile slightly but caused massive Bun regression (73ms→265ms build). Lint also failed on unused import.","timestamp":1775498873526,"segment":2,"confidence":3.909448818897636,"iterationTokens":8781,"asi":{"hypothesis":"Replace recursive initializeOpenVisibleCounts with a backward node iteration to eliminate ~700K recursive function calls.","rollback_reason":"checks_failed: lint caught unused PATH_STORE_NODE_FLAG_ROOT import. More critically, the Bun benchmark p50 regressed from 73ms to 265ms while Chrome profile was flat/slightly better. This suggests Bun's JSC runtime cannot optimize the backward loop pattern as well as V8 can.","next_action_hint":"Do NOT pursue non-recursive initializeOpenVisibleCounts — Bun strongly prefers the recursive pattern. Look for other optimizations in the appendPresortedPaths loop instead.","learning":"Bun (JSC) and Chrome (V8) have very different performance characteristics for recursive vs iterative tree traversal. V8 handles both well but Bun strongly favors recursion here."}}
{"run":41,"commit":"748bbc7","metric":129.5,"metrics":{"profile_visible_rows_ready_p95_ms":136.96,"profile_post_paint_ready_median_ms":130.4,"profile_post_paint_ready_p95_ms":137.96,"presorted_full_first_render_p50_ms":73.115292,"presorted_full_first_render_p95_ms":266.306167,"prepare_presorted_input_p50_ms":0.354833,"prepare_presorted_input_p95_ms":0.451792,"build_p50_ms":72.759042,"build_p95_ms":265.85225,"visible_first_p50_ms":0.001417,"visible_first_p95_ms":0.002125,"rename_leaf_p50_ms":0.013,"rename_leaf_p95_ms":0.016875,"rename_root_directory_p50_ms":0.723417,"rename_root_directory_p95_ms":0.761042},"status":"keep","description":"Cache the parent directory index in buildPresortedFinish forward pass to reduce Map.get calls for consecutive children sharing the same parent.","timestamp":1775498994998,"segment":2,"confidence":3.14866979655712,"iterationTokens":8903,"asi":{"hypothesis":"Consecutive nodes in presorted order often share the same parent directory. A single-entry parent cache in the forward pass of buildPresortedFinish avoids repeated Map.get lookups.","validation":"Profile median improved 130.8ms to 129.5ms (-1.0%). Bun p50 improved 73.6ms to 73.1ms (-0.7%). Small but consistent.","total_from_baseline":"Profile: 230.1ms → 129.5ms (-43.7%). Bun: 149.1ms → 73.1ms (-51.0%).","learning_nonrecursive":"Previous attempt to make initializeOpenVisibleCounts non-recursive caused massive Bun regression (73ms→65ms). Bun (JSC) strongly prefers recursive tree traversal.","next_action_hint":"The dominant remaining cost is appendPresortedPaths (~55ms in Bun). Try reducing node object allocation overhead, or batch-creating file nodes for consecutive paths in the same directory."}}
{"run":42,"commit":"748bbc7","metric":129.2,"metrics":{"profile_visible_rows_ready_p95_ms":134.66,"profile_post_paint_ready_median_ms":130.2,"profile_post_paint_ready_p95_ms":135.74,"presorted_full_first_render_p50_ms":73.484626,"presorted_full_first_render_p95_ms":268.146792,"prepare_presorted_input_p50_ms":0.355125,"prepare_presorted_input_p95_ms":0.43525,"build_p50_ms":73.128084,"build_p95_ms":267.709417,"visible_first_p50_ms":0.001417,"visible_first_p95_ms":0.002125,"rename_leaf_p50_ms":0.013,"rename_leaf_p95_ms":0.016875,"rename_root_directory_p50_ms":0.723417,"rename_root_directory_p95_ms":0.761042},"status":"discard","description":"Skip visibleSubtreeCount accumulation in backward pass — negligible improvement (0.3ms), within noise.","timestamp":1775499084221,"segment":2,"confidence":2.5728900255754477,"iterationTokens":5170,"asi":{"hypothesis":"Since initializeOpenVisibleCounts always overwrites visibleSubtreeCount, the backward pass can skip accumulating it to save ~700K additions.","rollback_reason":"Profile improved only 0.3ms (well within noise). Bun p50 slightly regressed. The single addition per node is too cheap to measure.","next_action_hint":"Focus on the appendPresortedPaths loop which is the dominant remaining cost. Try reducing node allocation overhead or optimizing the prefix comparison.","learning":"Removing a single addition from a ~700K loop saves ~1.4ms in theory, but in practice the savings are below the measurement noise floor."}}
{"run":43,"commit":"15638f2","metric":123.9,"metrics":{"profile_visible_rows_ready_p95_ms":126.02,"profile_post_paint_ready_median_ms":124.9,"profile_post_paint_ready_p95_ms":127.1,"presorted_full_first_render_p50_ms":73.207416,"presorted_full_first_render_p95_ms":245.633209,"prepare_presorted_input_p50_ms":0.354666,"prepare_presorted_input_p95_ms":0.433334,"build_p50_ms":72.851333,"build_p95_ms":245.197792,"visible_first_p50_ms":0.001417,"visible_first_p95_ms":0.002083,"rename_leaf_p50_ms":0.013,"rename_leaf_p95_ms":0.016875,"rename_root_directory_p50_ms":0.723417,"rename_root_directory_p95_ms":0.761042},"status":"keep","description":"Replace manual char-by-char slash scanning with String.indexOf for directory segment detection in the presorted ingest loop; V8's native SIMD-optimized indexOf is faster.","timestamp":1775499221436,"segment":2,"confidence":2.854838709677419,"iterationTokens":7868,"asi":{"hypothesis":"The manual for loop scanning each character for '/' is slower than native String.indexOf which can use SIMD optimizations. For the common case (no new directories, just a file basename), indexOf returns -1 in one native call vs N JavaScript charCodeAt comparisons.","validation":"Profile median improved 129.5ms to 123.9ms (-4.3%). Profile p95 also improved 137.0ms to 126.0ms (-8.0%). Bun p50 flat but Bun p95 improved from 266ms to 245ms.","total_from_baseline":"Profile: 230.1ms → 123.9ms (-46.2%). Bun: 149.1ms → 73.2ms (-50.9%).","mechanism":"Replaced `for (let index = ...; ...; index++) { if (charCodeAt !== 47) continue; }` with `let slashPos = path.indexOf('/', segmentStart); while (slashPos >= 0 && slashPos < endIndex) { ... slashPos = path.indexOf('/', segmentStart); }`. Same logic but native SIMD-backed search.","next_action_hint":"Try the same indexOf approach for the prefix comparison. Also consider whether the trailing-slash directory segment handling can be simplified."}}
{"run":44,"commit":"fe49f3f","metric":119.1,"metrics":{"profile_visible_rows_ready_p95_ms":124.12,"profile_post_paint_ready_median_ms":120.1,"profile_post_paint_ready_p95_ms":125.36,"presorted_full_first_render_p50_ms":55.409208,"presorted_full_first_render_p95_ms":76.457751,"prepare_presorted_input_p50_ms":0.3555,"prepare_presorted_input_p95_ms":0.484125,"build_p50_ms":55.052292,"build_p95_ms":75.971542,"visible_first_p50_ms":0.001416,"visible_first_p95_ms":0.002084,"rename_leaf_p50_ms":0.013,"rename_leaf_p95_ms":0.016875,"rename_root_directory_p50_ms":0.723417,"rename_root_directory_p95_ms":0.761042},"status":"keep","description":"Cache directory prefix string and use native startsWith for fast prefix comparison on consecutive files in the same directory; eliminates char-by-char JavaScript comparison for ~90% of paths.","timestamp":1775499442827,"segment":2,"confidence":3.343373493975902,"iterationTokens":13246,"asi":{"hypothesis":"Consecutive files in the same directory share a common directory prefix. Caching this prefix string and using native String.startsWith avoids the JavaScript char-by-char comparison for ~90% of paths. The inner indexOf loop handles any new subdirectories beyond the cached prefix.","validation":"Profile median improved 123.9ms to 119.1ms (-3.9%). Bun p50 improved massively from 73.2ms to 55.4ms (-24.3%). Bun p95 fixed from 245ms to 76ms — the persistent outlier issue is resolved!","total_from_baseline":"Profile: 230.1ms → 119.1ms (-48.2%). Bun p50: 149.1ms → 55.4ms (-62.8%). Bun p95: 159.3ms → 76.5ms (-52.0%).","mechanism":"Cache cachedDirPrefix (substring up to segmentStart) and cachedDirDepth. For paths where path.startsWith(cachedDirPrefix), set sharedDirectoryDepth and unsharedSegmentStart from cache, skipping the full prefix comparison. Only update the cache when the directory actually changes (segmentStart !== cachedDirPrefix.length).","p95_fix":"The Bun p95 outlier (~245-270ms) was likely caused by the large inline prefix comparison making the loop body too complex for Bun's JSC JIT to optimize reliably. The startsWith cache simplifies the hot path, allowing stable JIT optimization.","next_action_hint":"The Bun build is now 55ms with healthy p50/p95 ratio. Remaining costs: node object allocation (~700K objects), internSegment, path.slice. Try reducing node properties or optimizing the segment table lookup."}}
{"run":45,"commit":"b96177c","metric":113.3,"metrics":{"profile_visible_rows_ready_p95_ms":116.68,"profile_post_paint_ready_median_ms":114.3,"profile_post_paint_ready_p95_ms":117.68,"presorted_full_first_render_p50_ms":55.34925,"presorted_full_first_render_p95_ms":74.932792,"prepare_presorted_input_p50_ms":0.354792,"prepare_presorted_input_p95_ms":0.442042,"build_p50_ms":54.993,"build_p95_ms":74.488584,"visible_first_p50_ms":0.001458,"visible_first_p95_ms":0.002166,"rename_leaf_p50_ms":0.013,"rename_leaf_p95_ms":0.016875,"rename_root_directory_p50_ms":0.723417,"rename_root_directory_p95_ms":0.761042},"status":"keep","description":"Replace for...of with indexed for loop in initializeOpenVisibleCounts child iteration; Chrome V8 benefits significantly from the simpler loop pattern.","timestamp":1775499562952,"segment":2,"confidence":3.5883256528417804,"iterationTokens":7437,"asi":{"hypothesis":"V8's for...of on arrays creates an iterator with hidden overhead in recursive closures. An indexed for loop avoids this and should be faster for the ~700K total child iterations in initializeOpenVisibleCounts.","validation":"Profile median improved 119.1ms to 113.3ms (-4.9%). Profile p95 improved 124.1ms to 116.7ms (-6.0%). Bun p50 flat (55.4ms to 55.3ms), suggesting this optimization is V8-specific.","total_from_baseline":"Profile: 230.1ms → 113.3ms (-50.8%). Bun: 149.1ms → 55.3ms (-62.9%).","mechanism":"Changed `for (const childId of currentIndex.childIds)` to `for (let ci = 0; ci < childIds.length; ci++)` with a local `childIds` reference. Also simplified the null check and array access pattern.","next_action_hint":"Try the same for...of to indexed loop conversion in other hot paths like rebuildVisibleChildChunks. Also consider whether initializeOpenVisibleCounts can avoid the directories.get Map lookup by passing the directory index alongside the node ID."}}
{"run":46,"commit":"2235dcf","metric":110.6,"metrics":{"profile_visible_rows_ready_p95_ms":111.66,"profile_post_paint_ready_median_ms":111.7,"profile_post_paint_ready_p95_ms":112.74,"presorted_full_first_render_p50_ms":54.417335,"presorted_full_first_render_p95_ms":76.724084,"prepare_presorted_input_p50_ms":0.354709,"prepare_presorted_input_p95_ms":0.441125,"build_p50_ms":54.061209,"build_p95_ms":76.280834,"visible_first_p50_ms":0.001417,"visible_first_p95_ms":0.002125,"rename_leaf_p50_ms":0.013,"rename_leaf_p95_ms":0.016875,"rename_root_directory_p50_ms":0.723417,"rename_root_directory_p95_ms":0.761042},"status":"keep","description":"Inline file-node case in initializeOpenVisibleCounts to skip ~600K recursive calls; only recurse for directory nodes.","timestamp":1775499631992,"segment":2,"confidence":3.7460815047021936,"iterationTokens":4339,"asi":{"hypothesis":"In initializeOpenVisibleCounts, ~600K out of ~700K recursive calls are for file nodes which immediately return 1. Inlining the file check avoids the function call overhead for these trivial cases.","validation":"Profile median improved 113.3ms to 110.6ms (-2.4%). Profile p95 improved 116.7ms to 111.7ms (-4.3%). Bun p50 improved slightly from 55.3ms to 54.4ms.","total_from_baseline":"Profile: 230.1ms → 110.6ms (-51.9%). Bun: 149.1ms → 54.4ms (-63.5%).","mechanism":"Check childNode.kind inside the child loop and only call computeVisibleCounts recursively for directory children. File children directly add 1 to totalChildVisibleSubtreeCount without a function call.","next_action_hint":"Continue looking at initializeOpenVisibleCounts: try passing the directory index to avoid directories.get() lookup, or try optimizing rebuildVisibleChildChunks for the common small-directory case."}}
{"run":47,"commit":"2235dcf","metric":110.4,"metrics":{"profile_visible_rows_ready_p95_ms":111.02,"profile_post_paint_ready_median_ms":111.3,"profile_post_paint_ready_p95_ms":111.94,"presorted_full_first_render_p50_ms":58.873249,"presorted_full_first_render_p95_ms":79.295417,"prepare_presorted_input_p50_ms":0.3545,"prepare_presorted_input_p95_ms":0.437708,"build_p50_ms":58.517291,"build_p95_ms":78.855625,"visible_first_p50_ms":0.001458,"visible_first_p95_ms":0.002084,"rename_leaf_p50_ms":0.013125,"rename_leaf_p95_ms":0.0175,"rename_root_directory_p50_ms":0.724,"rename_root_directory_p95_ms":0.756917},"status":"discard","description":"Validation with mutation guardrails on unchanged code; profile stable at 110.4ms, mutations remain sub-millisecond, all lazy maps work correctly.","timestamp":1775499777662,"segment":2,"confidence":4.543726235741445,"iterationTokens":7662,"asi":{"hypothesis":"Validation run with mutation guardrails to confirm lazy maps work correctly after all optimizations.","rollback_reason":"No code changes; validation-only rerun.","validation":"Profile stable at 110.4ms. Mutation guardrails healthy: rename-leaf p50=0.013ms, rename-root-directory p50=0.724ms. All lazy ensureChildIdByNameId and ensureChildPositions rebuilds work correctly.","next_action_hint":"The dominant remaining cost is appendPresortedPaths (~40ms in Bun). Try removing node.id property or optimizing internSegment."}}
{"run":48,"commit":"2235dcf","metric":110.7,"metrics":{"profile_visible_rows_ready_p95_ms":117.18,"profile_post_paint_ready_median_ms":111.8,"profile_post_paint_ready_p95_ms":118.18,"presorted_full_first_render_p50_ms":54.926208,"presorted_full_first_render_p95_ms":76.275416,"prepare_presorted_input_p50_ms":0.354291,"prepare_presorted_input_p95_ms":0.429291,"build_p50_ms":54.5705,"build_p95_ms":75.844041,"visible_first_p50_ms":0.001417,"visible_first_p95_ms":0.002084,"rename_leaf_p50_ms":0.013,"rename_leaf_p95_ms":0.016875,"rename_root_directory_p50_ms":0.723417,"rename_root_directory_p95_ms":0.761042},"status":"checks_failed","description":"Remove node.id property — tsc failed because sed didn't fully remove the id lines from builder.ts and canonical.ts.","timestamp":1775499931925,"segment":2,"confidence":4.649805447470814,"iterationTokens":7318,"asi":{"hypothesis":"Remove the id property from PathStoreNode to save one property per ~700K node object allocations.","rollback_reason":"checks_failed: tsc failed because the sed command didn't properly remove all id lines. Profile was flat at 110.7ms anyway.","next_action_hint":"Fix the sed issue and retry. But the benchmark shows 110.7ms which is flat vs 110.6ms, suggesting removing id doesn't actually help performance. The object hidden class transition might be more important than the property count.","learning":"The profile was flat (110.7ms vs 110.6ms) despite removing 1 of 10 properties. V8's object allocation cost may not scale linearly with property count for small objects in the 9-10 property range."}}
