{"run":14,"commit":"9b1d33f","metric":137.445208,"metrics":{"presorted_full_first_render_p95_ms":153.935458,"prepare_presorted_input_p50_ms":35.82475,"prepare_presorted_input_p95_ms":51.530375,"build_p50_ms":101.618958,"build_p95_ms":102.402458,"visible_first_p50_ms":0.0015,"visible_first_p95_ms":0.002625,"profile_visible_rows_ready_median_ms":232.8,"profile_visible_rows_ready_p95_ms":233.08,"profile_post_paint_ready_median_ms":233.9,"profile_post_paint_ready_p95_ms":234.08},"status":"keep","description":"For trusted preparedInput, skip per-child collision lookups while appending the known-new suffix beyond the shared prefix.","timestamp":1775446280781,"segment":1,"confidence":2.389488194416795,"iterationTokens":5547,"asi":{"hypothesis":"Once preparedInput is trusted as sorted unique canonical data, every new segment beyond the shared prefix is a known-new child, so the builder can skip parent-child collision lookups in that suffix.","validation":"Primary full metric improved from 138.7ms to 137.4ms. Chrome profile was essentially flat, so treat this as a small Bun-side builder win rather than a broadly visible product-level speedup.","mechanism":"Use unchecked file/directory creation helpers for validateOrder=false appendPreparedPaths() while still preserving duplicate exact-path rejection via the previous-path comparison.","safety":"This further strengthens the preparedInput contract: raw path ingestion keeps the defensive lookup path, while explicit preparedInput takes the faster trusted path.","next_action_hint":"Because the browser truth-check was nearly flat, prefer future changes that improve both prepare and build or move page.createStore more clearly."}}
{"run":15,"commit":"9b1d33f","metric":142.327292,"metrics":{"presorted_full_first_render_p95_ms":159.1815,"prepare_presorted_input_p50_ms":63.612167,"prepare_presorted_input_p95_ms":77.89625,"build_p50_ms":78.713667,"build_p95_ms":81.282667,"visible_first_p50_ms":0.001458,"visible_first_p95_ms":0.002583,"profile_visible_rows_ready_median_ms":237.5,"profile_visible_rows_ready_p95_ms":239.84,"profile_post_paint_ready_median_ms":238.5,"profile_post_paint_ready_p95_ms":240.84},"status":"discard","description":"Precomputing shared-directory depth during prepare improved build but made prepare too expensive for the combined full presorted metric.","timestamp":1775446764453,"segment":1,"confidence":2.648010619939653,"iterationTokens":8074,"asi":{"hypothesis":"If prepare annotates each path with the shared directory depth versus the previous path, the builder can skip repeated shared-prefix work and reduce full first-render time.","rollback_reason":"Primary metric regressed versus the current best even though build got faster; the extra prepare work outweighed the build savings.","next_action_hint":"Keep shared-prefix computation in the builder and target hotspots that reduce prepare and build together, such as internSegment or the manual parser's remaining allocation cost.","learning":"For the corrected full metric, moving work from build into prepare is often a bad trade unless the total cost drops sharply. The current winner is still the manual prepare path plus trusted prepared-input builder shortcuts."}}
{"run":16,"commit":"9b1d33f","metric":141.515416,"metrics":{"presorted_full_first_render_p95_ms":162.820209,"prepare_presorted_input_p50_ms":34.989708,"prepare_presorted_input_p95_ms":52.378417,"build_p50_ms":106.52425,"build_p95_ms":110.439417,"visible_first_p50_ms":0.001458,"visible_first_p95_ms":0.002375,"profile_visible_rows_ready_median_ms":229.5,"profile_visible_rows_ready_p95_ms":233.54,"profile_post_paint_ready_median_ms":230.4,"profile_post_paint_ready_p95_ms":234.64},"status":"discard","description":"Deferring directory lookup-map population until finish() kept prepare fast but made build slower overall than the current best full-metric configuration.","timestamp":1775446918105,"segment":1,"confidence":2.796612249375799,"iterationTokens":8992,"asi":{"hypothesis":"The trusted prepared-input build path might get cheaper if it stops maintaining childIdByNameId and childPositionById incrementally and rebuilds those maps once at finish().","rollback_reason":"Primary metric regressed versus the current best; the extra whole-tree map rebuild cost outweighed the saved per-child Map.set work.","next_action_hint":"Keep the incremental map maintenance and focus on hotspots that reduce work in the actual prepare/build loops, not deferred rebuild passes.","learning":"For this workload, pushing lookup-map work to a second pass is worse than paying the incremental maintenance cost during ingest, even though Chrome profile medians nudged down slightly."}}
{"run":17,"commit":"61802df","metric":127.239,"metrics":{"presorted_full_first_render_p95_ms":144.315043,"prepare_presorted_input_p50_ms":36.203083,"prepare_presorted_input_p95_ms":49.772834,"build_p50_ms":91.034458,"build_p95_ms":94.539417,"visible_first_p50_ms":0.001459,"visible_first_p95_ms":0.002792,"profile_visible_rows_ready_median_ms":230.9,"profile_visible_rows_ready_p95_ms":235.62,"profile_post_paint_ready_median_ms":231.9,"profile_post_paint_ready_p95_ms":236.62},"status":"keep","description":"Replace the segment table's string→id Map with a null-prototype object for direct property lookup during segment interning and lookup.","timestamp":1775447026662,"segment":1,"confidence":4.623561708165979,"iterationTokens":2984,"asi":{"hypothesis":"String-key lookups in the segment table are still hot, so replacing the Map with a null-prototype object should reduce segment interning and lookup overhead during prepare/build.","validation":"Full metric improved from 137.4ms to 127.2ms, mostly via build dropping from 101.6ms to 91.0ms. Browser profile stayed in-family with a slightly better median, so this does not look like benchmark-only drift.","mechanism":"Use direct object property reads/writes for segmentTable.idByValue in segments.ts/canonical.ts instead of Map.get()/Map.set().","tradeoff":"Bun benefits more than Chrome here; profile medians improved slightly while p95 stayed noisy.","next_action_hint":"Re-run a mutation guardrail soon, then keep targeting build-side hotspots like createFileChild or remaining path-parser overhead."}}
{"run":18,"commit":"61802df","metric":126.873709,"metrics":{"presorted_full_first_render_p95_ms":146.558167,"prepare_presorted_input_p50_ms":35.1435,"prepare_presorted_input_p95_ms":51.1405,"build_p50_ms":91.72875,"build_p95_ms":95.414875,"visible_first_p50_ms":0.001459,"visible_first_p95_ms":0.002792,"profile_visible_rows_ready_median_ms":227.2,"profile_visible_rows_ready_p95_ms":233.96,"profile_post_paint_ready_median_ms":228.3,"profile_post_paint_ready_p95_ms":234.96,"rename_leaf_p50_ms":0.012959,"rename_leaf_p95_ms":0.019625,"rename_root_directory_p50_ms":0.715417,"rename_root_directory_p95_ms":0.755792},"status":"discard","description":"Validation rerun on unchanged segment-table object lookup code; full metric and profile both stayed strong, and mutation guardrails remained healthy.","timestamp":1775447104986,"segment":1,"confidence":4.544924025682654,"iterationTokens":2531,"asi":{"hypothesis":"The object-backed segment table should survive a rerun with similar or slightly better full-metric behavior, and it should not hurt representative mutation latency.","rollback_reason":"No code changes; this was a validation-only rerun, so discard rather than create another keep commit for the same code.","next_action_hint":"Continue searching for prepare/build wins on top of the object-backed segment table, and only rerun mutation guardrails after larger structural changes.","learning":"Current best code remains stable across reruns, and representative mutation timings are still sub-millisecond."}}
{"run":19,"commit":"61802df","metric":145.4695,"metrics":{"presorted_full_first_render_p95_ms":162.306166,"prepare_presorted_input_p50_ms":34.957625,"prepare_presorted_input_p95_ms":50.447708,"build_p50_ms":110.5105,"build_p95_ms":111.856167,"visible_first_p50_ms":0.001375,"visible_first_p95_ms":0.002291,"profile_visible_rows_ready_median_ms":264.3,"profile_visible_rows_ready_p95_ms":270.06,"profile_post_paint_ready_median_ms":265.4,"profile_post_paint_ready_p95_ms":271.08,"rename_leaf_p50_ms":0.012959,"rename_leaf_p95_ms":0.019625,"rename_root_directory_p50_ms":0.715417,"rename_root_directory_p95_ms":0.755792},"status":"checks_failed","description":"Object-backed per-directory child indexes regressed both the full benchmark and profile, and the refactor also failed lint due to a stale .has() call and an unused type import.","timestamp":1775447378655,"segment":1,"confidence":4.623561708165979,"iterationTokens":12060,"asi":{"hypothesis":"Replacing per-directory child maps with null-prototype objects might reduce append/look-up overhead the same way object-backed segment ids helped.","rollback_reason":"checks_failed: lint caught a stale .has() call and an unused import, and the measured full metric/profile had already regressed enough that this refactor was not worth salvaging.","next_action_hint":"Do not pursue object-backed per-directory child indexes further; return to prepare/build hotspots with a better chance of helping both benchmark and profile.","learning":"The segment-table object win does not generalize to directory child indexes. Those lookup patterns appear to prefer the existing Map-based structure here."}}
{"run":20,"commit":"61802df","metric":128.228999,"metrics":{"presorted_full_first_render_p95_ms":144.490792,"prepare_presorted_input_p50_ms":35.633166,"prepare_presorted_input_p95_ms":50.176125,"build_p50_ms":92.594375,"build_p95_ms":94.31175,"visible_first_p50_ms":0.001458,"visible_first_p95_ms":0.002917,"profile_visible_rows_ready_median_ms":229.2,"profile_visible_rows_ready_p95_ms":236.42,"profile_post_paint_ready_median_ms":230.3,"profile_post_paint_ready_p95_ms":237.4,"rename_leaf_p50_ms":0.012959,"rename_leaf_p95_ms":0.019625,"rename_root_directory_p50_ms":0.715417,"rename_root_directory_p95_ms":0.755792},"status":"checks_failed","description":"Lazy file path caches during bulk ingest were slightly slower than the current best and also failed lint because createFileChildUnchecked kept an unused path parameter.","timestamp":1775447549411,"segment":1,"confidence":4.544924025682654,"iterationTokens":8156,"asi":{"hypothesis":"Skipping upfront full-path cache population for bulk-ingested file nodes might reduce build cost enough that the small extra visible-window materialization cost still wins on the full metric.","rollback_reason":"checks_failed: lint caught the now-unused unchecked path parameter, and the measured full metric was already slightly worse than the current best.","next_action_hint":"If revisiting lazy path caches, remove the unused parameter and test a more selective strategy, but deprioritize it behind clearer prepare/build wins.","learning":"Lazy file path caching did not beat the current best. Upfront file path references are not the main remaining bottleneck."}}
{"run":21,"commit":"61802df","metric":127.130708,"metrics":{"presorted_full_first_render_p95_ms":163.591001,"prepare_presorted_input_p50_ms":34.866291,"prepare_presorted_input_p95_ms":48.674375,"build_p50_ms":92.262959,"build_p95_ms":114.913792,"visible_first_p50_ms":0.001458,"visible_first_p95_ms":0.002834,"profile_visible_rows_ready_median_ms":230.2,"profile_visible_rows_ready_p95_ms":253.7,"profile_post_paint_ready_median_ms":231.3,"profile_post_paint_ready_p95_ms":254.72,"rename_leaf_p50_ms":0.012959,"rename_leaf_p95_ms":0.019625,"rename_root_directory_p50_ms":0.715417,"rename_root_directory_p95_ms":0.755792},"status":"discard","description":"Reusing the caller's readonly paths array in preparePresortedInput() produced only a tiny full-metric gain on the first run and looked too small/noisy to trust without confirmation.","timestamp":1775447652298,"segment":1,"confidence":3.9448446372119808,"iterationTokens":747,"asi":{"hypothesis":"preparePresortedInput() may spend measurable time copying the already-sorted readonly paths array, so reusing the caller array could slightly lower the full presorted metric.","rollback_reason":"Initial improvement was too small and noisy to trust; rerunning the same code is necessary before keeping any contract change here.","next_action_hint":"Use the next rerun as the deciding measurement. If it is not clearly better again, discard this idea and keep the safer copying behavior.","learning":"This optimization, if real, is much smaller than the previous wins and may not justify changing preparedInput ownership semantics."}}
{"run":22,"commit":"61802df","metric":130.955458,"metrics":{"presorted_full_first_render_p95_ms":145.095751,"prepare_presorted_input_p50_ms":36.079375,"prepare_presorted_input_p95_ms":48.391292,"build_p50_ms":94.874583,"build_p95_ms":96.701542,"visible_first_p50_ms":0.0015,"visible_first_p95_ms":0.002917,"profile_visible_rows_ready_median_ms":230.8,"profile_visible_rows_ready_p95_ms":231.34,"profile_post_paint_ready_median_ms":231.8,"profile_post_paint_ready_p95_ms":232.42,"rename_leaf_p50_ms":0.012959,"rename_leaf_p95_ms":0.019625,"rename_root_directory_p50_ms":0.715417,"rename_root_directory_p95_ms":0.755792},"status":"discard","description":"Confirmatory rerun of the no-copy preparePresortedInput() candidate came back slower than the current best, so the first tiny gain was just noise.","timestamp":1775447664732,"segment":1,"confidence":2.7538594042193445,"iterationTokens":747,"asi":{"hypothesis":"If array-copy removal is a real win, it should reproduce on an immediate rerun with the same code.","rollback_reason":"The confirmatory rerun was slower than the current best, so the first-run improvement was not reliable enough to justify changing preparedInput ownership semantics.","next_action_hint":"Drop this idea and go back to bigger prepare/build hotspots with clearer end-to-end wins.","learning":"Removing the paths-array clone is below the session noise floor and not worth the API/contract risk."}}
{"run":23,"commit":"61802df","metric":129.808876,"metrics":{"presorted_full_first_render_p95_ms":145.275959,"prepare_presorted_input_p50_ms":37.498834,"prepare_presorted_input_p95_ms":49.053167,"build_p50_ms":92.308583,"build_p95_ms":96.219959,"visible_first_p50_ms":0.001459,"visible_first_p95_ms":0.002833,"profile_visible_rows_ready_median_ms":228,"profile_visible_rows_ready_p95_ms":228.9,"profile_post_paint_ready_median_ms":229.1,"profile_post_paint_ready_p95_ms":230,"rename_leaf_p50_ms":0.012959,"rename_leaf_p95_ms":0.019625,"rename_root_directory_p50_ms":0.715417,"rename_root_directory_p95_ms":0.755792},"status":"discard","description":"Preallocating the prepared-path array and replacing Array.map() with an indexed loop nudged the browser profile down a bit, but it was still slower than the current best full-metric code.","timestamp":1775447767381,"segment":1,"confidence":2.627389700547339,"iterationTokens":4404,"asi":{"hypothesis":"Array.map() callback overhead during parseInputPath over hundreds of thousands of entries may be measurable enough that an indexed loop with a preallocated output array wins.","rollback_reason":"Primary metric regressed versus the current best even though the browser profile moved slightly in the right direction.","next_action_hint":"Stop micro-optimizing the path-array traversal wrapper and focus on the heavier remaining costs: splitCanonicalPath, internSegment, and file-node creation.","learning":"The wrapper around parseInputPath is not the dominant bottleneck; changing it did not beat the current best despite a tiny profile improvement."}}
{"type":"config","name":"Optimize path-store profile demo visible rows ready","metricName":"profile_visible_rows_ready_median_ms","metricUnit":"ms","bestDirection":"lower"}
{"run":24,"commit":"506769a","metric":230.1,"metrics":{"profile_visible_rows_ready_p95_ms":234.92,"profile_post_paint_ready_median_ms":231.1,"profile_post_paint_ready_p95_ms":235.92,"presorted_full_first_render_p50_ms":128.664167,"presorted_full_first_render_p95_ms":148.2045,"prepare_presorted_input_p50_ms":36.634042,"prepare_presorted_input_p95_ms":55.461167,"build_p50_ms":92.028625,"build_p95_ms":92.740458,"visible_first_p50_ms":0.0015,"visible_first_p95_ms":0.002875},"status":"keep","description":"Baseline after switching the primary metric to profile:demo visible-rows-ready median; benchmark is now a secondary monitor.","timestamp":1775492103067,"segment":2,"confidence":null,"iterationTokens":150,"asi":{"hypothesis":"Use the browser-backed profile metric as the main scorekeeper because it is the most reflective real-world first-render measurement.","alignment":"profile_visible_rows_ready_median_ms is now primary; the Bun full first-render benchmark remains as a secondary monitor for localization and runtime-specific shifts.","bottleneck":"Current code still spends most of the full path in prepare+build; visible-first remains effectively free.","next_action_hint":"Continue optimizing for lower browser visible-rows-ready median while checking that large wins do not come solely from Bun-side changes."}}
{"run":25,"commit":"0388669","metric":218.7,"metrics":{"profile_visible_rows_ready_p95_ms":221.3,"profile_post_paint_ready_median_ms":219.7,"profile_post_paint_ready_p95_ms":222.4,"presorted_full_first_render_p50_ms":145.335625,"presorted_full_first_render_p95_ms":146.686208,"prepare_presorted_input_p50_ms":0.355208,"prepare_presorted_input_p95_ms":0.4825,"build_p50_ms":144.979083,"build_p95_ms":146.200375,"visible_first_p50_ms":0.001334,"visible_first_p95_ms":0.003333},"status":"keep","description":"Make preparePresortedInput() a lightweight presorted-path wrapper and parse those paths on demand during store construction; profile improved even though the Bun benchmark regressed.","timestamp":1775492605936,"segment":2,"confidence":null,"iterationTokens":15789,"asi":{"hypothesis":"The browser cares more about avoiding a huge precomputed prepared-path object graph than Bun does, so making preparePresortedInput() lightweight and parsing during build may improve real-world visible-rows-ready time.","validation":"Primary profile metric improved from 230.1ms to 218.7ms and its p95 also improved, so this is a real browser-path win under the new target even though the Bun benchmark regressed.","tradeoff":"Bun full benchmark got worse because prepare became almost free while build absorbed the parsing work and slowed down. This is a runtime-specific trade rather than a universal improvement.","contract_change":"preparedInput from preparePresortedInput now stores presorted paths instead of eagerly materialized PreparedPath entries; prepareInput() still returns eagerly prepared entries.","next_action_hint":"Stay focused on browser-profile wins now that it is primary, but keep watching for regressions that are so large in Bun or mutations that they indicate a broader architectural problem."}}
{"run":26,"commit":"c5f56e4","metric":213.4,"metrics":{"profile_visible_rows_ready_p95_ms":219.32,"profile_post_paint_ready_median_ms":214.3,"profile_post_paint_ready_p95_ms":220.42,"presorted_full_first_render_p50_ms":144.596501,"presorted_full_first_render_p95_ms":153.764666,"prepare_presorted_input_p50_ms":0.354417,"prepare_presorted_input_p95_ms":0.43225,"build_p50_ms":144.240625,"build_p95_ms":153.328,"visible_first_p50_ms":0.001459,"visible_first_p95_ms":0.004416},"status":"keep","description":"Specialize appendPresortedPaths() to parse and append trusted presorted paths in one pass instead of routing each path through parseInputPath() plus the generic appendPreparedPath() helper.","timestamp":1775492799947,"segment":2,"confidence":3.150943396226423,"iterationTokens":7948,"asi":{"hypothesis":"If the browser-primary strategy is to defer presorted parsing into store construction, then the builder should handle that path with a dedicated parse+append loop instead of allocating PreparedPath objects and calling the generic appendPreparedPath() helper.","validation":"Primary profile metric improved from 218.7ms to 213.4ms and p95 also improved, so this one-pass presorted builder path is a real browser win on top of the lightweight preparedInput wrapper.","mechanism":"Use splitCanonicalPath() directly inside appendPresortedPaths(), compute the shared directory depth inline, and append directories/files without creating an intermediate PreparedPath object for every input string.","tradeoff":"The Bun benchmark remains much worse than the old eager-prepared-input path because build now owns almost all parsing work. That trade is acceptable only because the session now optimizes the browser profile.","next_action_hint":"Continue improving the browser-first presorted builder path itself — especially splitCanonicalPath, internSegment, and createFileChildUnchecked — instead of trying to restore the old eager-preparation benchmark shape."}}
