{"type":"config","name":"Optimize path-store presorted first render","metricName":"presorted_first_render_p50_ms","metricUnit":"ms","bestDirection":"lower"}
{"run":1,"commit":"a190e8c","metric":501.941626,"metrics":{"presorted_first_render_p95_ms":506.89675,"build_p50_ms":501.940167,"build_p95_ms":506.8945,"visible_first_p50_ms":0.001459,"visible_first_p95_ms":0.00225},"status":"keep","description":"Baseline with autoresearch harness; build dominates presorted first render while visible-first is negligible.","timestamp":1775439497972,"segment":0,"confidence":null,"iterationTokens":215,"asi":{"hypothesis":"Establish a trustworthy baseline and commit the autoresearch harness before making optimizations.","bottleneck":"Build/store creation dominates the workload; visible-first read is already effectively free.","truth_check":"Use profile:demo to verify any large benchmark win still improves the same end-to-end work.","guardrail":"Watch mutation latency periodically so first-render wins do not come from destroying interactive update performance."}}
{"run":2,"commit":"a190e8c","metric":473.521375,"metrics":{"presorted_first_render_p95_ms":477.416124,"build_p50_ms":473.519875,"build_p95_ms":477.413833,"visible_first_p50_ms":0.0015,"visible_first_p95_ms":0.002291},"status":"checks_failed","description":"Open-expansion visible-count initialization fast path improved the primary benchmark, but checks failed because the new prepared-input test fixture was accidentally unsorted.","timestamp":1775439887047,"segment":0,"confidence":null,"iterationTokens":24747,"asi":{"hypothesis":"Skipping the generic full-tree recompute for the common all-open startup path should reduce build time because the builder already finalized subtree counts.","observed_result":"~5.7% faster primary metric before revert, almost entirely from build time.","rollback_reason":"checks_failed: the optimization likely works, but the added regression test used a non-presorted fixture with preparePresortedInput() and failed before the candidate could be kept.","next_action_hint":"Reapply the open-startup visible-count fast path, fix the test fixture ordering (or build the prepared input with prepareInput instead), then rerun benchmark + checks and validate with profile:demo.","learning":"The dominant startup cost is still count initialization after builder.finish(); a targeted open-expansion initialization path is promising."}}
{"run":3,"commit":"db60f37","metric":474.797125,"metrics":{"presorted_first_render_p95_ms":481.526417,"build_p50_ms":474.795625,"build_p95_ms":481.524125,"visible_first_p50_ms":0.0015,"visible_first_p95_ms":0.002292,"profile_visible_rows_ready_median_ms":414.7,"profile_visible_rows_ready_p95_ms":424.44,"profile_post_paint_ready_median_ms":415.8,"profile_post_paint_ready_p95_ms":425.62},"status":"keep","description":"Fast-path open startup visible-count initialization avoids the generic full-tree recompute when there are no explicit expansion overrides.","timestamp":1775440041985,"segment":0,"confidence":21.277288653732818,"iterationTokens":6070,"asi":{"hypothesis":"The constructor can initialize visible counts much faster for the common initialExpansion=open path because the builder already finalized subtree counts and there are no expansion overrides to reconcile.","validation":"Primary benchmark improved ~5.4%, and profile:demo improved from ~602ms median to ~415ms median, so the win reflects real first-render work rather than moving work outside the benchmark.","mechanism":"Replace the generic recomputeCountsRecursive startup pass with an open-specific visible-count initialization that reuses builder snapshot data and only rebuilds visible child chunk summaries.","safety":"The fast path is gated to initialExpansion=open with no initialExpandedPaths; all other constructor shapes keep the generic path.","follow_up":"Measure mutation guardrails occasionally, but this change only touches constructor-time initialization so mutation regressions are unlikely."}}
{"run":4,"commit":"db60f37","metric":485.767292,"metrics":{"presorted_first_render_p95_ms":490.228749,"build_p50_ms":485.765792,"build_p95_ms":490.226458,"visible_first_p50_ms":0.0015,"visible_first_p95_ms":0.002291,"profile_visible_rows_ready_median_ms":414.7,"profile_visible_rows_ready_p95_ms":424.44,"profile_post_paint_ready_median_ms":415.8,"profile_post_paint_ready_p95_ms":425.62,"rename_leaf_p50_ms":0.013375,"rename_leaf_p95_ms":0.022542,"rename_root_directory_p50_ms":0.747291,"rename_root_directory_p95_ms":0.796},"status":"discard","description":"Measurement-only guardrail run with mutation scenarios; primary metric was worse than the current best, but constructor-time changes left representative mutation latencies near their prior sub-millisecond range.","timestamp":1775440119562,"segment":0,"confidence":4.433232888970229,"iterationTokens":3264,"asi":{"hypothesis":"The startup-only optimization should not materially affect interactive mutation latency, but it is worth spot-checking representative rename scenarios.","rollback_reason":"Primary metric regressed versus the kept best; this was a validation run with no new code changes, so discard the noisy slower measurement.","next_action_hint":"Continue optimizing startup, and rerun AUTORESEARCH_MUTATION_GUARD=1 occasionally after larger structural changes to keep an eye on mutation p50/p95.","guardrail_result":"Representative mutations remain fast: rename-leaf p50 ~0.013 ms, rename-root-directory p50 ~0.747 ms.","metrics_note":"Profile metrics were carried forward from the last measured validation run because this guardrail run only added mutation scenarios.","learning":"The current open-startup fast path appears isolated to constructor work; mutation guardrails did not show a tens-to-hundreds of ms regression."}}
{"run":5,"commit":"c57e2ba","metric":165.319958,"metrics":{"presorted_first_render_p95_ms":169.11325,"build_p50_ms":165.318417,"build_p95_ms":169.11,"visible_first_p50_ms":0.001541,"visible_first_p95_ms":0.00325,"profile_visible_rows_ready_median_ms":360.2,"profile_visible_rows_ready_p95_ms":367.58,"profile_post_paint_ready_median_ms":361.2,"profile_post_paint_ready_p95_ms":368.68,"rename_leaf_p50_ms":0.013375,"rename_leaf_p95_ms":0.022542,"rename_root_directory_p50_ms":0.747291,"rename_root_directory_p95_ms":0.796},"status":"keep","description":"Replace splitIntoNaturalTokens()'s matchAll() iterator with a cheaper exec() loop to reduce natural-sort tokenization overhead during build-time ordering work.","timestamp":1775440431095,"segment":0,"confidence":30.685190845317113,"iterationTokens":16469,"asi":{"hypothesis":"Natural-sort tokenization is spending too much time allocating iterator state inside matchAll(), so a simpler exec() loop should lower sort-key creation and prepared-path comparison overhead in the presorted build path.","validation":"Primary benchmark improved from 474.8ms to 165.3ms, and profile:demo also improved from 414.7ms to 360.2ms median visible-rows-ready, so the change helps real work even though Bun benefits much more than Chrome.","runtime_sensitivity":"The benchmark gain is far larger than the browser-profile gain, suggesting this optimization is especially valuable in Bun's runtime and should be followed up with phase-level browser profiling.","mechanism":"Keep the same tokenization semantics while replacing the iterator-heavy regex walk with a cheaper exec() loop that reuses the compiled regex.","follow_up":"Inspect page.createStore / builder phase deltas after this keep, and look for the next biggest constructor hotspot after sort-token creation."}}
{"run":6,"commit":"8675021","metric":141.605,"metrics":{"presorted_first_render_p95_ms":146.729749,"build_p50_ms":141.6035,"build_p95_ms":146.724666,"visible_first_p50_ms":0.0015,"visible_first_p95_ms":0.005083,"profile_visible_rows_ready_median_ms":354.2,"profile_visible_rows_ready_p95_ms":361.4,"profile_post_paint_ready_median_ms":355.7,"profile_post_paint_ready_p95_ms":362.42,"rename_leaf_p50_ms":0.013375,"rename_leaf_p95_ms":0.022542,"rename_root_directory_p50_ms":0.747291,"rename_root_directory_p95_ms":0.796},"status":"keep","description":"Replace the remaining regex-driven digit walk in splitIntoNaturalTokens() with a manual char-code scanner.","timestamp":1775440590431,"segment":0,"confidence":18.29564875396854,"iterationTokens":9224,"asi":{"hypothesis":"Even after removing matchAll(), regex-driven digit scanning still leaves overhead in natural-sort tokenization; a manual char-code scanner should reduce that cost further.","validation":"Primary benchmark improved from 165.3ms to 141.6ms, and profile:demo still improved from 360.2ms to 354.2ms median visible-rows-ready, so the change still helps the real startup flow.","mechanism":"Parse contiguous digit runs with a manual loop instead of regex state, reducing overhead in both sort-key creation and prepared-path comparison.","runtime_sensitivity":"The browser-truth-check gain is smaller than the Bun benchmark gain, so this remains a runtime-sensitive optimization rather than a universal 1:1 speedup.","follow_up":"Profile builder appendPreparedPaths again and then focus on the next hottest measured constructor cost, likely segment interning or file-child creation."}}
{"run":7,"commit":"19402e1","metric":116.206417,"metrics":{"presorted_first_render_p95_ms":117.809,"build_p50_ms":116.204917,"build_p95_ms":117.804875,"visible_first_p50_ms":0.0015,"visible_first_p95_ms":0.004125,"profile_visible_rows_ready_median_ms":331.1,"profile_visible_rows_ready_p95_ms":335.52,"profile_post_paint_ready_median_ms":332.2,"profile_post_paint_ready_p95_ms":336.54,"rename_leaf_p50_ms":0.013375,"rename_leaf_p95_ms":0.022542,"rename_root_directory_p50_ms":0.747291,"rename_root_directory_p95_ms":0.796},"status":"keep","description":"Cache segment sort keys during builder prepared-path order validation so repeated segment comparisons stop rebuilding natural-sort tokens.","timestamp":1775440725928,"segment":0,"confidence":13.572547582355972,"iterationTokens":6050,"asi":{"hypothesis":"Prepared-path order validation is still recreating the same natural-sort keys for common segment names, so caching those keys inside the builder should reduce constructor work without changing semantics.","validation":"Primary benchmark improved from 141.6ms to 116.2ms, and profile:demo improved from 354.2ms to 331.1ms median visible-rows-ready, so the cached validation path helps the real startup flow in both runtimes.","mechanism":"Use a builder-local Map<string, SegmentSortKey> for default-sort order validation instead of rebuilding sort keys for the same segment values on each adjacent prepared-path comparison.","safety":"This only changes the internal validation path for default-sort prepared input; custom comparators and all store semantics remain unchanged.","follow_up":"Re-profile the current build path and target the next remaining hot functions, likely internSegment or file-child creation."}}
{"run":8,"commit":"1ed0fc0","metric":73.755625,"metrics":{"presorted_first_render_p95_ms":74.629959,"build_p50_ms":73.754125,"build_p95_ms":74.624917,"visible_first_p50_ms":0.0015,"visible_first_p95_ms":0.005042,"profile_visible_rows_ready_median_ms":256.9,"profile_visible_rows_ready_p95_ms":259.1,"profile_post_paint_ready_median_ms":257.9,"profile_post_paint_ready_p95_ms":260.12,"rename_leaf_p50_ms":0.013375,"rename_leaf_p95_ms":0.022542,"rename_root_directory_p50_ms":0.747291,"rename_root_directory_p95_ms":0.796},"status":"keep","description":"Skip redundant builder order validation for explicit preparedInput and keep only duplicate-path checks in that fast path.","timestamp":1775440909008,"segment":0,"confidence":2.4882795759623777,"iterationTokens":7931,"asi":{"hypothesis":"preparedInput is already the caller's explicit sorted fast path, so rerunning full monotonic-order validation inside the builder is redundant work that can be removed from constructor time.","validation":"Primary benchmark improved from 116.2ms to 73.8ms, and profile:demo improved from 331.1ms to 256.9ms median visible-rows-ready, so skipping validation in the prepared-input fast path improves the real startup flow substantially.","mechanism":"When the constructor receives preparedInput, append prepared paths without per-entry order comparisons and keep only exact duplicate-path rejection.","contract_change":"This trusts the preparedInput contract more strongly. Raw paths and presorted raw path ingestion still keep builder-side order validation; only opaque preparedInput objects skip it.","follow_up":"Re-run mutation guardrails after the next structural optimization, and continue targeting the remaining builder hotspot: file-node creation / segment interning."}}
{"type":"config","name":"Optimize path-store full presorted first render","metricName":"presorted_full_first_render_p50_ms","metricUnit":"ms","bestDirection":"lower"}
{"run":9,"commit":"ba72cf1","metric":149.056626,"metrics":{"presorted_full_first_render_p95_ms":159.605917,"prepare_presorted_input_p50_ms":78.512959,"prepare_presorted_input_p95_ms":85.899083,"build_p50_ms":70.542208,"build_p95_ms":73.702792,"visible_first_p50_ms":0.001459,"visible_first_p95_ms":0.004042,"profile_visible_rows_ready_median_ms":246.8,"profile_visible_rows_ready_p95_ms":247.36,"profile_post_paint_ready_median_ms":247.9,"profile_post_paint_ready_p95_ms":248.44},"status":"keep","description":"Reinitialized the session to the fuller presorted first-render target that includes prepare-presorted-input so benchmark results line up honestly with profile:demo.","timestamp":1775445697981,"segment":1,"confidence":null,"iterationTokens":150,"asi":{"hypothesis":"The earlier primary benchmark was a warm-start metric; switching to the full presorted first-render metric should better align benchmark percentages with the browser profile truth-check.","alignment":"The corrected baseline now includes prepare-presorted-input, build, and first visible read, which matches the profile flow more closely.","explanation":"Current current-code baseline is ~149ms in Bun for the full path versus ~247ms in Chrome profile; the remaining gap is runtime/browser overhead rather than hidden benchmark work.","next_action_hint":"Continue optimizing against the full metric and keep reporting profile createStore/visibleRowsReady to guard against benchmark-only wins."}}
{"run":10,"commit":"b7acc9e","metric":147.046084,"metrics":{"presorted_full_first_render_p95_ms":152.293749,"prepare_presorted_input_p50_ms":79.374042,"prepare_presorted_input_p95_ms":83.1415,"build_p50_ms":67.670542,"build_p95_ms":69.112708,"visible_first_p50_ms":0.0015,"visible_first_p95_ms":0.039541,"profile_visible_rows_ready_median_ms":235.7,"profile_visible_rows_ready_p95_ms":237.62,"profile_post_paint_ready_median_ms":236.7,"profile_post_paint_ready_p95_ms":238.72},"status":"keep","description":"Make segment sort keys lazy in internSegment() so presorted bulk ingest stops precomputing natural-sort metadata for every unique segment.","timestamp":1775445870589,"segment":1,"confidence":null,"iterationTokens":150,"asi":{"hypothesis":"Bulk presorted ingest should not eagerly create natural-sort keys for every unique segment because the prepared-input startup path already arrives in canonical order.","validation":"Full metric improved from 149.1ms to 147.0ms, and profile:demo improved from 246.8ms to 235.7ms median visible-rows-ready, so this reduces real startup work rather than only benchmark-local work.","mechanism":"Store undefined sortKeyById entries on internSegment() and let getSegmentSortKey() materialize them lazily on first actual ordering use.","tradeoff":"prepare-presorted-input regressed slightly while build improved more, implying the net win comes from cheaper store construction rather than parsing.","next_action_hint":"Spot-check mutation guardrails after one or two more structural changes, since lazy sort-key creation can defer some cost into the first ordering-sensitive mutation."}}
{"run":11,"commit":"f734bb4","metric":142.661125,"metrics":{"presorted_full_first_render_p95_ms":172.926208,"prepare_presorted_input_p50_ms":36.007083,"prepare_presorted_input_p95_ms":48.779458,"build_p50_ms":106.652542,"build_p95_ms":124.141333,"visible_first_p50_ms":0.0015,"visible_first_p95_ms":0.005417,"profile_visible_rows_ready_median_ms":233.8,"profile_visible_rows_ready_p95_ms":238.28,"profile_post_paint_ready_median_ms":234.9,"profile_post_paint_ready_p95_ms":239.2},"status":"keep","description":"Use a single-pass manual scanner in splitCanonicalPath() to speed prepare-presorted-input, accepting a slower build path because the full presorted metric still improves.","timestamp":1775446001267,"segment":1,"confidence":3.1809835357829073,"iterationTokens":4046,"asi":{"hypothesis":"The prepare step still spends too much time in splitCanonicalPath(), so a single-pass scanner should reduce full-metric cost even if it changes the downstream string shape seen by the builder.","validation":"Full metric improved from 147.0ms to 142.7ms and profile:demo still improved slightly from 235.7ms to 233.8ms median visible-rows-ready, so the change does not appear to move work outside the measured path.","tradeoff":"This strongly speeds prepare-presorted-input but noticeably slows build and worsens p95, suggesting the new sliced segment strings are less builder-friendly than the old split()-produced strings.","caveat":"This is a weaker keep than the earlier ones because the browser truth-check moved only a little; if a later change recovers build-time friendliness without giving back prepare speed, prefer that.","next_action_hint":"Run a no-code validation measurement on the corrected full metric, then look for a hybrid parser that keeps prepare gains without hurting build."}}
{"run":12,"commit":"fbdc340","metric":138.742167,"metrics":{"presorted_full_first_render_p95_ms":159.339792,"prepare_presorted_input_p50_ms":35.949708,"prepare_presorted_input_p95_ms":55.250542,"build_p50_ms":102.791,"build_p95_ms":104.086625,"visible_first_p50_ms":0.001459,"visible_first_p95_ms":0.002625,"profile_visible_rows_ready_median_ms":230.9,"profile_visible_rows_ready_p95_ms":235.42,"profile_post_paint_ready_median_ms":231.9,"profile_post_paint_ready_p95_ms":236.54},"status":"keep","description":"Validation rerun on unchanged manual splitCanonicalPath() code confirmed the full-metric gain and showed a somewhat healthier tail than the first sample.","timestamp":1775446054671,"segment":1,"confidence":3.2255358884315726,"iterationTokens":4216,"asi":{"hypothesis":"Re-running the unchanged code against the corrected full metric should tell us whether the manual path parser win is noise or a stable improvement.","validation":"The rerun improved further from 142.7ms to 138.7ms and profile:demo moved from 233.8ms to 230.9ms median visible-rows-ready, increasing confidence that the change is real.","learning":"The manual parser consistently crushes prepare-presorted-input, but build remains materially slower than with the prior split()-based strings. Future work should look for a hybrid path representation that keeps prepare gains without harming build as much.","next_action_hint":"Investigate builder-side costs that are sensitive to segment string shape, especially internSegment hashing and file-child creation, and consider a parser that reuses basename/path slices differently."}}
{"run":13,"commit":"fbdc340","metric":150.369332,"metrics":{"presorted_full_first_render_p95_ms":155.985251,"prepare_presorted_input_p50_ms":82.3735,"prepare_presorted_input_p95_ms":86.908834,"build_p50_ms":67.994291,"build_p95_ms":69.071584,"visible_first_p50_ms":0.001541,"visible_first_p95_ms":0.004833,"profile_visible_rows_ready_median_ms":237,"profile_visible_rows_ready_p95_ms":241.64,"profile_post_paint_ready_median_ms":238.1,"profile_post_paint_ready_p95_ms":242.66},"status":"discard","description":"Hybrid split('/') parser without the pre-split trailing-slash slice recovered build speed but lost too much prepare performance versus the current best manual parser.","timestamp":1775446126075,"segment":1,"confidence":3.1037283404669105,"iterationTokens":2967,"asi":{"hypothesis":"Using split('/') directly on the original string and popping the trailing empty segment might keep the builder-friendly string shape from split() while avoiding the extra whole-string slice cost in prepare-presorted-input.","rollback_reason":"Primary metric regressed versus the current best manual parser; prepare became much slower again and the small build win did not make up for it.","next_action_hint":"Keep the manual parser for now and investigate builder-side costs directly instead of trying to recover split()-style segment strings.","learning":"The current best full-metric result depends more on crushing prepare-presorted-input than on preserving the old faster build behavior. The split()-produced strings are not worth the prepare-time cost."}}
