{"run":27,"commit":"c5f56e4","metric":212.6,"metrics":{"profile_visible_rows_ready_p95_ms":220.18,"profile_post_paint_ready_median_ms":213.6,"profile_post_paint_ready_p95_ms":221.26,"presorted_full_first_render_p50_ms":162.84325,"presorted_full_first_render_p95_ms":164.572709,"prepare_presorted_input_p50_ms":0.35475,"prepare_presorted_input_p95_ms":0.43175,"build_p50_ms":162.487125,"build_p95_ms":164.128834,"visible_first_p50_ms":0.001375,"visible_first_p95_ms":0.012125},"status":"discard","description":"More aggressive inlining inside appendPresortedPaths() shaved only ~0.8ms off the browser median while severely regressing the Bun benchmark.","timestamp":1775492969240,"segment":2,"confidence":5.475409836065549,"iterationTokens":7069,"asi":{"hypothesis":"Inlining node creation and child-index updates directly into appendPresortedPaths() might trim the remaining helper-call overhead in the browser-first fast path.","rollback_reason":"Discarded despite a tiny primary improvement because the gain was likely within noise and the secondary Bun benchmark regressed catastrophically (~+12.6% on full first render).","next_action_hint":"Keep the simpler specialized appendPresortedPaths() version and look for optimizations that help the browser more clearly without blowing up the Bun secondary monitor.","learning":"Not every browser-path micro-optimization is worth the runtime-specific trade. The current profile-first strategy still needs guardrails against disproportionately large Bun regressions."}}
{"run":28,"commit":"485b879","metric":182.1,"metrics":{"profile_visible_rows_ready_p95_ms":190.84,"profile_post_paint_ready_median_ms":183.1,"profile_post_paint_ready_p95_ms":191.94,"presorted_full_first_render_p50_ms":152.203834,"presorted_full_first_render_p95_ms":161.741292,"prepare_presorted_input_p50_ms":0.354667,"prepare_presorted_input_p95_ms":0.436375,"build_p50_ms":151.847709,"build_p95_ms":161.302209,"visible_first_p50_ms":0.001458,"visible_first_p95_ms":0.002708},"status":"keep","description":"Fuse presorted path splitting with shared-prefix detection so the browser-first builder path no longer pays a second computeSharedPrefixLength() pass.","timestamp":1775493083563,"segment":2,"confidence":9.056603773584936,"iterationTokens":4655,"asi":{"hypothesis":"The browser-first presorted builder path is still paying redundant work by splitting every path and then scanning the resulting segments again to find the shared prefix with the previous path.","validation":"Primary profile metric improved sharply from 213.4ms to 182.1ms, with p95 and post-paint metrics improving similarly, so fusing split+shared-prefix detection is a strong real-world win under the new target.","mechanism":"Add a specialized splitPresortedInputPath() helper that builds the segment list and tracks sharedPrefixLength in the same pass, eliminating a second computeSharedPrefixLength() walk for the browser-first presorted builder path.","tradeoff":"The Bun full benchmark regressed again because this browser-focused path now owns more work inside build and Bun reacts differently to that organization than Chrome.","next_action_hint":"Re-run the unchanged code once for confidence and then keep targeting the browser-first appendPresortedPaths() path; splitCanonicalPath and internSegment remain hot inside that loop."}}
{"run":29,"commit":"485b879","metric":186.4,"metrics":{"profile_visible_rows_ready_p95_ms":193.48,"profile_post_paint_ready_median_ms":187.5,"profile_post_paint_ready_p95_ms":194.58,"presorted_full_first_render_p50_ms":149.997,"presorted_full_first_render_p95_ms":162.651959,"prepare_presorted_input_p50_ms":0.354792,"prepare_presorted_input_p95_ms":0.437709,"build_p50_ms":149.640792,"build_p95_ms":162.211625,"visible_first_p50_ms":0.001416,"visible_first_p95_ms":0.002625,"rename_leaf_p50_ms":0.013208,"rename_leaf_p95_ms":0.015916,"rename_root_directory_p50_ms":0.735417,"rename_root_directory_p95_ms":0.76625},"status":"discard","description":"Validation rerun on unchanged browser-first split+shared-prefix code; still a strong improvement over baseline and mutation guardrails stayed healthy, but this sample was slower than the current best.","timestamp":1775493161687,"segment":2,"confidence":4.210526315789477,"iterationTokens":2502,"asi":{"hypothesis":"The large browser win from the fused split+shared-prefix path should reproduce, and it should not damage representative mutation latency.","rollback_reason":"No code changes; this was a validation-only rerun and it came back slower than the best kept sample, so discard the measurement rather than creating another commit.","next_action_hint":"Keep the fused browser-first path, retain mutation metrics as secondary monitors, and continue optimizing splitCanonicalPath/internSegment/createFileChildUnchecked inside the new appendPresortedPaths loop.","learning":"The current best code is stable and still far better than baseline, but profile noise is real enough that small follow-up wins should be treated cautiously.","guardrail_result":"Representative mutations remain healthy: rename-leaf p50 ~0.013 ms, rename-root-directory p50 ~0.735 ms."}}
{"run":30,"commit":"df1af77","metric":180.4,"metrics":{"profile_visible_rows_ready_p95_ms":189.64,"profile_post_paint_ready_median_ms":181.4,"profile_post_paint_ready_p95_ms":190.62,"presorted_full_first_render_p50_ms":152.166251,"presorted_full_first_render_p95_ms":162.904417,"prepare_presorted_input_p50_ms":0.357417,"prepare_presorted_input_p95_ms":0.434666,"build_p50_ms":151.8075,"build_p95_ms":162.467167,"visible_first_p50_ms":0.001334,"visible_first_p95_ms":0.002584,"rename_leaf_p50_ms":0.013208,"rename_leaf_p95_ms":0.015916,"rename_root_directory_p50_ms":0.735417,"rename_root_directory_p95_ms":0.76625},"status":"keep","description":"Keep lazy file-path caches for bulk-ingested files; browser visible-rows-ready improved again while the Bun monitor stayed essentially flat.","timestamp":1775495201365,"segment":2,"confidence":2.8399999999999994,"iterationTokens":2502,"asi":{"hypothesis":"On the browser-first presorted builder path, eagerly caching every bulk-ingested file's full path string still costs measurable time and allocations even though first render only needs the visible window.","validation":"Profile visible-rows-ready median improved from 182.1ms to 180.4ms, with p95 and post-paint metrics improving too. The Bun secondary monitor stayed effectively flat/slightly better (152.204ms -> 152.166ms).","mechanism":"Change createFileChildUnchecked() to leave file-node pathCache null with a stale version so canonical path materialization stays lazy for trusted bulk-ingested files.","guardrail_note":"Mutation guardrail metrics were carried forward from the latest nearby validation run; this startup-only change is unlikely to affect mutation latency materially, but remeasure after the next larger structural change.","safety":"The ordered/defensive createFileChild() path still caches eagerly for collision-checked ingestion; only the trusted unchecked bulk-ingest path becomes lazy.","next_action_hint":"Keep targeting the browser-first appendPresortedPaths() loop, especially remaining string allocation and segment interning work now that shared-prefix detection and file-path caching are both deferred."}}
{"run":31,"commit":"2621517","metric":174.4,"metrics":{"profile_visible_rows_ready_p95_ms":181.12,"profile_post_paint_ready_median_ms":175.4,"profile_post_paint_ready_p95_ms":182.2,"presorted_full_first_render_p50_ms":112.662874,"presorted_full_first_render_p95_ms":116.341168,"prepare_presorted_input_p50_ms":0.354666,"prepare_presorted_input_p95_ms":0.446959,"build_p50_ms":112.306875,"build_p95_ms":115.891625,"visible_first_p50_ms":0.001333,"visible_first_p95_ms":0.002584,"rename_leaf_p50_ms":0.013208,"rename_leaf_p95_ms":0.015916,"rename_root_directory_p50_ms":0.735417,"rename_root_directory_p95_ms":0.76625},"status":"keep","description":"Replace segment-array allocation in presorted builder with direct string comparison for shared-prefix detection; both browser profile and Bun benchmark improved significantly.","timestamp":1775496030545,"segment":2,"confidence":3.052054794520547,"iterationTokens":2502,"asi":{"hypothesis":"Instead of splitting every presorted path into a segment array and then comparing segments for shared-prefix length, compare the raw path strings character-by-character to find the shared prefix, and only slice individual segments from the unshared suffix. This avoids allocating arrays of string segments entirely.","validation":"Profile median improved from 180.4ms to 174.4ms and Bun benchmark improved dramatically from 152.2ms to 112.7ms, so this optimization helps both runtimes significantly.","mechanism":"getPresortedPathPrefixInfo() compares inputPath and previousPath char-by-char to find sharedDirectoryDepth and unsharedSegmentStart, then appendPresortedPaths() only slices segments from unsharedSegmentStart onwards.","tradeoff":"This is the first optimization that improved both browser profile AND Bun benchmark together. The Bun build improvement is especially large (-26%) because it eliminates the per-path segment array allocation that Bun was particularly sensitive to.","next_action_hint":"Continue looking for allocation reduction and hot-path improvements in the remaining builder work: internSegment, createDirectoryChild, createFileChildUnchecked."}}
{"run":32,"commit":"2621517","metric":173.5,"metrics":{"profile_visible_rows_ready_p95_ms":186.72,"profile_post_paint_ready_median_ms":174.5,"profile_post_paint_ready_p95_ms":187.66,"presorted_full_first_render_p50_ms":104.9415,"presorted_full_first_render_p95_ms":107.620209,"prepare_presorted_input_p50_ms":0.356917,"prepare_presorted_input_p95_ms":0.489542,"build_p50_ms":104.583208,"build_p95_ms":107.128,"visible_first_p50_ms":0.001375,"visible_first_p95_ms":0.002667,"rename_leaf_p50_ms":0.013208,"rename_leaf_p95_ms":0.015916,"rename_root_directory_p50_ms":0.735417,"rename_root_directory_p95_ms":0.76625},"status":"checks_failed","description":"Deferred directory-index creation in presorted builder — metrics look great but lint failed on unnecessary type assertion.","timestamp":1775496535786,"segment":2,"confidence":4.317829457364338,"iterationTokens":51837,"asi":{"hypothesis":"Defer all directory-index creation and child registration to finish() so the presorted loop only creates node objects and tracks the directory stack, eliminating per-child Map operations.","rollback_reason":"checks_failed: lint caught an unnecessary non-null assertion on nodes[nodeId]! in buildDirectoryIndexes.","next_action_hint":"Fix the lint error by removing the ! assertion, then rerun."}}
{"run":33,"commit":"626340e","metric":174.1,"metrics":{"profile_visible_rows_ready_p95_ms":174.6,"profile_post_paint_ready_median_ms":175.1,"profile_post_paint_ready_p95_ms":175.76,"presorted_full_first_render_p50_ms":104.999499,"presorted_full_first_render_p95_ms":109.204125,"prepare_presorted_input_p50_ms":0.357083,"prepare_presorted_input_p95_ms":0.434291,"build_p50_ms":104.641,"build_p95_ms":108.767209,"visible_first_p50_ms":0.001416,"visible_first_p95_ms":0.002625,"rename_leaf_p50_ms":0.013208,"rename_leaf_p95_ms":0.015916,"rename_root_directory_p50_ms":0.735417,"rename_root_directory_p95_ms":0.76625},"status":"keep","description":"Defer all directory-index creation and child registration to finish() so the presorted loop only creates node objects; eliminates per-child Map operations during hot ingest.","timestamp":1775496618438,"segment":2,"confidence":5.358851674641147,"iterationTokens":5335,"asi":{"hypothesis":"The presorted builder loop spends significant time on per-child Map operations (getDirectoryIndex, childIdByNameId.set, appendChildReference, directories.set) that are never read during construction. Deferring all of this to finish() should improve cache locality and reduce per-path overhead.","validation":"Profile median improved marginally (174.4→174.1ms) while p95 improved significantly (181.1→174.6ms). Bun benchmark improved 112.7→105.0ms (-6.8%). The deferred approach clearly helps by concentrating Map operations in a single tight pass.","mechanism":"During appendPresortedPaths, inline node creation directly into the loop without touching directory indexes. In finish(), a single buildDirectoryIndexes pass iterates all nodes once to create DirectoryChildIndex structures and register children. Node IDs preserve sorted child order since they are assigned sequentially.","safety":"Added hasDeferredDirectoryIndexes guard in appendPreparedPath so mixed presorted+non-presorted usage still works correctly.","next_action_hint":"The remaining hot path is internSegment, node object allocation, and the getPresortedPathPrefixInfo comparison. Look at reducing node object allocation cost or internSegment overhead."}}
{"run":34,"commit":"c255b16","metric":165.3,"metrics":{"profile_visible_rows_ready_p95_ms":166.9,"profile_post_paint_ready_median_ms":166.3,"profile_post_paint_ready_p95_ms":167.92,"presorted_full_first_render_p50_ms":99.243666,"presorted_full_first_render_p95_ms":140.435584,"prepare_presorted_input_p50_ms":0.356625,"prepare_presorted_input_p95_ms":0.438292,"build_p50_ms":98.885666,"build_p95_ms":139.994708,"visible_first_p50_ms":0.001375,"visible_first_p95_ms":0.002584,"rename_leaf_p50_ms":0.013208,"rename_leaf_p95_ms":0.015916,"rename_root_directory_p50_ms":0.735417,"rename_root_directory_p95_ms":0.76625},"status":"keep","description":"Inline prefix comparison and use explicit stack-top index in presorted builder loop to avoid per-path result object allocation and Array.push/length overhead.","timestamp":1775497311610,"segment":2,"confidence":7.534883720930235,"iterationTokens":43623,"asi":{"hypothesis":"The getPresortedPathPrefixInfo function allocates a new result object per path (~700K allocations) and the directoryStack uses Array.push/length mutations. Inlining the prefix comparison and using explicit stack-top indexing should reduce allocation pressure and avoid Array method overhead.","validation":"Profile median improved from 174.1ms to 165.3ms (-5.1%) and Bun p50 improved from 105.0ms to 99.2ms (-5.5%). Profile p95 also improved. Bun p95 regressed but likely noise from a single bad iteration.","mechanism":"Replaced getPresortedPathPrefixInfo() call with inline char-by-char comparison using local variables. Replaced directoryStack.push()/length mutation with explicit stackTop counter and dirStack[stackTop] = nodeId.","bun_p95_note":"Bun p95 went from 109.2ms to 140.4ms which is concerning but the p50 improved and the profile (primary metric) improved consistently. Will monitor on subsequent runs.","next_action_hint":"The remaining hot path costs are node object allocation, internSegment, and path.slice(). Consider fusing buildDirectoryIndexes+computeSubtreeCounts, or trying to reduce node allocation overhead."}}
{"run":35,"commit":"590fbb8","metric":163.5,"metrics":{"profile_visible_rows_ready_p95_ms":164.92,"profile_post_paint_ready_median_ms":164.6,"profile_post_paint_ready_p95_ms":165.86,"presorted_full_first_render_p50_ms":99.558542,"presorted_full_first_render_p95_ms":140.994418,"prepare_presorted_input_p50_ms":0.356542,"prepare_presorted_input_p95_ms":0.440834,"build_p50_ms":99.200625,"build_p95_ms":140.550959,"visible_first_p50_ms":0.001375,"visible_first_p95_ms":0.002625,"rename_leaf_p50_ms":0.013208,"rename_leaf_p95_ms":0.015916,"rename_root_directory_p50_ms":0.735417,"rename_root_directory_p95_ms":0.76625},"status":"keep","description":"Fuse buildDirectoryIndexes and computeSubtreeCounts into linear passes for the presorted case, eliminating recursive tree descent.","timestamp":1775497488060,"segment":2,"confidence":5.620253164556964,"iterationTokens":2115,"asi":{"hypothesis":"The recursive computeSubtreeCounts creates ~700K stack frames and rebuildDirectoryChildAggregates iterates children redundantly. Linear backward pass + forward chunk pass should be faster due to no recursion overhead and better cache locality.","validation":"Profile median improved 165.3ms to 163.5ms (-1.1%). Profile p95 also improved. Bun p50 was essentially flat (99.2ms to 99.6ms). The recursion elimination helped the browser more than Bun.","mechanism":"buildPresortedFinish() does: 1) Forward pass to create directory indexes and register children, 2) Backward pass to accumulate subtree counts and directory aggregates bottom-up, 3) Final pass to rebuild visible child chunks. This replaces recursive computeSubtreeCounts + per-directory rebuildDirectoryChildAggregates.","bun_p95_note":"Bun p95 stayed at ~141ms, similar to previous run. This persistent p95 elevation might be a real issue worth investigating.","next_action_hint":"The remaining opportunities: try skipping childPositionById population during construction (lazy init for mutations), or look at reducing node object allocation overhead."}}
{"run":36,"commit":"870604b","metric":148.7,"metrics":{"profile_visible_rows_ready_p95_ms":153,"profile_post_paint_ready_median_ms":149.8,"profile_post_paint_ready_p95_ms":154.08,"presorted_full_first_render_p50_ms":84.998667,"presorted_full_first_render_p95_ms":273.434333,"prepare_presorted_input_p50_ms":0.356125,"prepare_presorted_input_p95_ms":0.440208,"build_p50_ms":84.641167,"build_p95_ms":272.990959,"visible_first_p50_ms":0.001375,"visible_first_p95_ms":0.003166,"rename_leaf_p50_ms":0.013208,"rename_leaf_p95_ms":0.015916,"rename_root_directory_p50_ms":0.735417,"rename_root_directory_p95_ms":0.76625},"status":"keep","description":"Skip childPositionById population and rebuildVisibleChildChunks during presorted construction; positions are rebuilt lazily on first mutation and chunks are rebuilt during state initialization.","timestamp":1775498023365,"segment":2,"confidence":5.390728476821194,"iterationTokens":32315,"asi":{"hypothesis":"childPositionById is only needed for mutations and sibling lookups, not the initial render. Skipping its population during presorted construction saves ~700K Map.set calls. Similarly, rebuildVisibleChildChunks during buildPresortedFinish is redundant because state initialization always rebuilds chunks.","validation":"Profile median improved 163.5ms to 148.7ms (-9.0%). Bun p50 improved from 99.6ms to 85.0ms (-14.7%). Bun p95 regressed to 273ms but this is likely a single GC-heavy iteration out of 5.","mechanism":"Created createPresortedDirectoryChildIndex() with null childPositionById. Added ensureChildPositions() helper that lazily rebuilds positions from childIds on first mutation/lookup. Removed the redundant rebuildVisibleChildChunks final pass since initializeOpenVisibleCounts/recomputeCountsRecursive always rebuilds them.","bun_p95_note":"Bun p95 at 273ms vs p50 at 85ms suggests one extreme outlier iteration, not a systematic issue. The 3.2x p50/p95 ratio is much worse than usual (~1.4x). Should normalize on rerun.","next_action_hint":"The remaining buildPresortedFinish hot spots are childIdByNameId.set (still ~700K Map.set calls), directories.get (Map lookups in the backward pass), and the createPresortedDirectoryChildIndex allocations (~100K). Consider deferring childIdByNameId like we deferred childPositionById."}}
{"run":37,"commit":"ceeda9b","metric":132.3,"metrics":{"profile_visible_rows_ready_p95_ms":134.22,"profile_post_paint_ready_median_ms":133.3,"profile_post_paint_ready_p95_ms":135.26,"presorted_full_first_render_p50_ms":76.164458,"presorted_full_first_render_p95_ms":263.512708,"prepare_presorted_input_p50_ms":0.354708,"prepare_presorted_input_p95_ms":0.448375,"build_p50_ms":75.808334,"build_p95_ms":263.06225,"visible_first_p50_ms":0.001416,"visible_first_p95_ms":0.002083,"rename_leaf_p50_ms":0.013208,"rename_leaf_p95_ms":0.015916,"rename_root_directory_p50_ms":0.735417,"rename_root_directory_p95_ms":0.76625},"status":"keep","description":"Also defer childIdByNameId population during presorted construction; both Map types are now lazy, leaving the forward pass with only childIds.push and directories.get per node.","timestamp":1775498331506,"segment":2,"confidence":7.523076923076922,"iterationTokens":21217,"asi":{"hypothesis":"childIdByNameId is also only needed for lookups/mutations, not the first render. Deferring it like childPositionById saves another ~700K Map.set calls during the forward pass of buildPresortedFinish.","validation":"Profile median improved 148.7ms to 132.3ms (-11.0%). Bun p50 improved 85.0ms to 76.2ms (-10.4%). Both are massive wins from baseline: profile -42.5%, Bun p50 -48.9%.","mechanism":"createPresortedDirectoryChildIndex() now creates both childIdByNameId: null and childPositionById: null. Added ensureChildIdByNameId() that lazily rebuilds from childIds + node nameIds. All read/write sites in canonical.ts, projection.ts, and builder.ts use the ensure helpers.","total_from_baseline":"Profile: 230.1ms → 132.3ms (-42.5%). Bun: 149.1ms → 76.2ms (-48.9%).","bun_p95_note":"Bun p95 still elevated at 263.5ms (outlier pattern), p50 is healthy at 76.2ms.","next_action_hint":"The forward pass now only does directories.get() + childIds.push() per node. Remaining hot costs are appendPresortedPaths (node allocation, internSegment, prefix comparison) and the directories.get() Map lookup in the backward pass. Consider caching parent indexes or eliminating the backward pass Map lookups."}}
